{
  "packlists": {
    "subspls": {
      "type": "episodic",
      "metaType": ["text"],
      "maxConcurrentDownloads": 2,
      "trusted": [
        "CR-HOLLAND|NEW",
        "CR-HOLLAND-IPv6|NEW",
        "CR-ARUTHA|NEW",
        "CR-ARUTHA-IPv6|NEW",
        "ARUTHA-BATCH|1080p",
        "ARUTHA-BATCH|720p",
        "ARUTHA-BATCH|SD",
        "Ginpachi-Sensei"
      ],
      "current": "CR-HOLLAND|NEW",
      "refreshInterval": 900
    }
  },
  "clear": "on",
  "shows": {},
  "archived": {},
  "credentials": {},
  "storeVer": "4.0"
}
